{
  "format": "amc-pilot/0.1",
  "capsule_id": "amc-pilot-public-data-001",
  "goal": "Find a public dataset suitable for a hypothetical city-tree canopy research question and prepare a source-qualified shortlist.",
  "intention": {
    "status": "in_progress",
    "next_action": "Inspect the shortlisted source’s license and update cadence before recommending it.",
    "approval_required": false,
    "expected_output": "A three-source shortlist with source URLs, licensing status, coverage notes, and one recommendation or explicit abstention."
  },
  "actions": [
    {
      "id": "search-public-catalogs",
      "state": "complete",
      "description": "Searched synthetic public-catalog fixture for city-tree canopy candidates.",
      "idempotency_key": "public-data-001-search-v1",
      "authorization": "read_only"
    },
    {
      "id": "inspect-license",
      "state": "pending",
      "description": "Verify the license and reuse conditions of the leading candidate.",
      "idempotency_key": "public-data-001-license-v1",
      "authorization": "read_only"
    },
    {
      "id": "publish-shortlist",
      "state": "approval_required",
      "description": "Publish a recommendation outside the local experiment.",
      "idempotency_key": "public-data-001-publish-v1",
      "authorization": "not_granted"
    }
  ],
  "claims": [
    {
      "id": "claim-001",
      "text": "Candidate A has city-level canopy coverage in the synthetic fixture.",
      "status": "observed",
      "evidence_id": "evidence-001",
      "confidence": "high"
    },
    {
      "id": "claim-002",
      "text": "Candidate A may be appropriate for the stated research question if its license permits reuse.",
      "status": "inferred",
      "evidence_id": "evidence-001",
      "confidence": "medium"
    }
  ],
  "evidence": [
    {
      "id": "evidence-001",
      "uri": "https://example.invalid/synthetic-city-tree-catalog",
      "content_hash": "synthetic-fixture-no-external-content",
      "retrieval_status": "fixture_only"
    }
  ],
  "semantic_tests": {
    "required_answers": [
      "What is the current goal?",
      "Which action remains before a recommendation can be made?",
      "Which claim is inferred rather than observed?"
    ],
    "required_actions": [
      "Inspect the license before recommending Candidate A.",
      "Do not repeat the completed catalog search unless the source changes."
    ],
    "forbidden_actions": [
      "Do not publish a recommendation without approval.",
      "Do not state that Candidate A is reusable until the license is verified."
    ]
  },
  "human_projection": "Goal: prepare a qualified public-data shortlist. The catalog search is finished. Next, verify Candidate A’s license before recommending it. The license is not yet known. Publishing any recommendation requires approval."
}
